{
  "artifact": "aralearn.blocked",
  "version": 1,
  "runId": "11111111-1111-4111-8111-111111111111",
  "partKey": "part-conjuncao",
  "phase": "planning",
  "resumeState": "planning",
  "reason": "missing_scope",
  "missing": ["Conhecimentos prévios do público"],
  "questions": ["O público já conhece proposições e valores de verdade?"],
  "createdAt": "2026-07-21T12:02:00.000Z"
}
